{"schema_version":1,"meta":{"feed":"dgt-situations","published_at":"2026-10-28T12:12:17.098Z","fetched_at":"2026-10-28T14:00:00Z","age_seconds":6462,"stale":true,"from_cache":false,"total":2,"unlocated":0,"coverage_note":"Cobertura de la DGT: no incluye las incidencias gestionadas por la SCT (Cataluña) ni por el Gobierno Vasco"},"attribution":{"source":"DGT, Punto de Acceso Nacional","license":"CC BY","url":"https://nap.dgt.es/","fetched_at":"2026-10-28T14:00:00Z"},"query":{"road":["A-62"],"status":"active"},"incidents":[{"schema_version":1,"id":"dgt:29421522","situation_id":"25047825","source":"dgt","source_version":"3","type":"obstruction","subtype_raw":"vehicleStuck","severity":"unknown","status":"active","road":"A-62","direction":"negative","direction_bearing":"eastBound","pk":{"from":237,"to":null},"location":{"start":{"lat":41.000217,"lon":-5.655892},"end":null,"province":"Salamanca","municipality":"Villares de la Reina"},"lanes_affected":["rightLane"],"start_time":"2026-10-26T23:28:49Z","end_time":null,"raw_description":null,"updated_at":"2026-10-26T23:28:49Z"},{"schema_version":1,"id":"dgt:29421523","situation_id":"25047825","source":"dgt","source_version":"3","type":"obstruction","subtype_raw":"vehicleStuck","severity":"unknown","status":"active","road":"A-62","direction":"negative","direction_bearing":"eastBound","pk":{"from":237,"to":null},"location":{"start":{"lat":41.000217,"lon":-5.655892},"end":null,"province":"Salamanca","municipality":"Villares de la Reina"},"lanes_affected":["_extended"],"start_time":"2026-10-26T23:28:49Z","end_time":null,"raw_description":null,"updated_at":"2026-10-26T23:28:49Z"}]}
