{"schema_version":1,"meta":{"feed":"dgt-situations","published_at":"2026-10-28T12:12:17.098Z","fetched_at":"2026-10-28T14:00:00Z","age_seconds":6462,"stale":true,"from_cache":false,"total":1,"unlocated":0,"coverage_note":"Cobertura de la DGT: no incluye las incidencias gestionadas por la SCT (Cataluña) ni por el Gobierno Vasco"},"attribution":{"source":"DGT, Punto de Acceso Nacional","license":"CC BY","url":"https://nap.dgt.es/","fetched_at":"2026-10-28T14:00:00Z"},"incidents":[{"schema_version":1,"id":"dgt:18811074","situation_id":"2816645","source":"dgt","source_version":"3","type":"roadworks","subtype_raw":"roadworks","severity":"unknown","status":"active","road":"N-400","direction":"both","direction_bearing":"unknown","pk":{"from":37.1,"to":37.3},"location":{"start":{"lat":39.993732,"lon":-3.6074991},"end":{"lat":39.994446,"lon":-3.6054852},"province":"Toledo","municipality":"Ontígola"},"lanes_affected":["allLanesCompleteCarriageway"],"start_time":"2025-12-12T07:05:19Z","end_time":null,"raw_description":null,"updated_at":"2025-12-12T07:11:34Z"}]}
