{"schema_version":1,"meta":{"feed":"dgt-situations","published_at":"2026-10-28T12:12:17.098Z","fetched_at":"2026-10-28T14:00:00Z","age_seconds":6462,"stale":true,"from_cache":false,"total":2,"unlocated":0,"coverage_note":"Cobertura de la DGT: no incluye las incidencias gestionadas por la SCT (Cataluña) ni por el Gobierno Vasco"},"attribution":{"source":"DGT, Punto de Acceso Nacional","license":"CC BY","url":"https://nap.dgt.es/","fetched_at":"2026-10-28T14:00:00Z"},"query":{"type":["accident"],"status":"all"},"incidents":[{"schema_version":1,"id":"dgt:23477355","situation_id":"19403469","source":"dgt","source_version":"3","type":"accident","subtype_raw":"accident","severity":"unknown","status":"active","road":"CG-1.5","direction":"positive","direction_bearing":"southWestBound","pk":{"from":16.997,"to":17.2},"location":{"start":{"lat":42.829906,"lon":-8.74629},"end":{"lat":42.82866,"lon":-8.748287},"province":"A Coruña","municipality":"Rois"},"lanes_affected":["rightLane"],"start_time":"2026-05-25T17:05:17Z","end_time":null,"raw_description":null,"updated_at":"2026-05-25T17:07:10Z"},{"schema_version":1,"id":"dgt:28494088","situation_id":"24175992","source":"dgt","source_version":"3","type":"accident","subtype_raw":"accident","severity":"unknown","status":"active","road":"DP-5903","direction":"both","direction_bearing":"unknown","pk":{"from":14.3,"to":null},"location":{"start":{"lat":43.015697,"lon":-8.539868},"end":null,"province":"A Coruña","municipality":"Trazo"},"lanes_affected":["allLanesCompleteCarriageway"],"start_time":"2026-09-29T16:33:41Z","end_time":null,"raw_description":null,"updated_at":"2026-09-29T16:33:41Z"}]}
