{"schema_version":1,"meta":{"feed":"dgt-situations","published_at":"2026-10-28T12:12:17.098Z","fetched_at":"2026-10-28T14:00:00Z","age_seconds":6462,"stale":true,"from_cache":false,"total":2,"unlocated":0,"coverage_note":"Cobertura de la DGT: no incluye las incidencias gestionadas por la SCT (Cataluña) ni por el Gobierno Vasco"},"attribution":{"source":"DGT, Punto de Acceso Nacional","license":"CC BY","url":"https://nap.dgt.es/","fetched_at":"2026-10-28T14:00:00Z"},"query":{"road":["A-372"],"pk":{"from":50,"to":51},"status":"active"},"incidents":[{"schema_version":1,"id":"dgt:24713336","situation_id":"18367717","source":"dgt","source_version":"3","type":"restriction","subtype_raw":"other","severity":"unknown","status":"active","road":"A-372","direction":"both","direction_bearing":"unknown","pk":{"from":50.25,"to":50.65},"location":{"start":{"lat":36.76135,"lon":-5.360078},"end":{"lat":36.759094,"lon":-5.3622985},"province":"Cádiz","municipality":"Grazalema"},"lanes_affected":["allLanesCompleteCarriageway"],"start_time":"2026-06-26T09:42:28Z","end_time":null,"raw_description":null,"updated_at":"2026-06-26T09:44:10Z"},{"schema_version":1,"id":"dgt:24713337","situation_id":"18367717","source":"dgt","source_version":"3","type":"restriction","subtype_raw":"other","severity":"unknown","status":"active","road":"A-372","direction":"both","direction_bearing":"unknown","pk":{"from":45.5,"to":52.8},"location":{"start":{"lat":36.760555,"lon":-5.3856072},"end":{"lat":36.752773,"lon":-5.349793},"province":"Cádiz","municipality":"Grazalema"},"lanes_affected":["allLanesCompleteCarriageway"],"start_time":"2026-06-26T09:43:40Z","end_time":null,"raw_description":null,"updated_at":"2026-06-26T09:44:10Z"}]}
